content,content_cutted,label_name,posibility
这还能坚持玩的下去，得是多绿的飞舞龟？？？,飞舞,未知,[0.5 0.5]
mhy:谁让你们带入黄毛了，选女主代入散兵啊[大笑],选女 主 代入 散兵,原神_散兵_主角,[0.83296157 0.16703843]
吃过一遍的直接跳36分钟[doge],,未知,[0.5 0.5]
大风老师的含金量还在提升[Mygo表情包_有趣的女人],大风 老师 含金量 表情 女人,未知,[0.5 0.5]
我们既要看到他犯下的错误，也要看到他更大的错误，客观的来看，mhy的策划是过大于过的，我们不能揪着他的小错误不放，应该揪着他的大错误@原神 @崩坏星穹铁道 @绝区零 @原神动画项目? @米哈游miHoYo,错误 错误 客观 策划 小 错误 大 错误 原神 星穹 铁道 绝区 零 原神 动画 项目 游,原神_散兵_主角,[0.87489356 0.12510644]
@迷你世界官方频道 是你！,世界 官方 频道,原神_散兵_主角,[0.73066573 0.26933427]
你攻击了实在是太高了,,未知,[0.5 0.5]
6,,未知,[0.5 0.5]
能把主角删掉吗[打call],主角,原神_散兵_主角,[0.74988137 0.25011863]
吐槽多发[抠鼻],,未知,[0.5 0.5]
这个题材和白荆格兰索差不多同样监督在里面甚至都变史莱姆了勇者也不是主角但是展现力完全不一样咱们监督在里面那存在感真是无敌不当人都是个萌物[吃瓜]里面看似在讲游戏剧情但是各种角色转变都不突兀主要表达的那种儿时到长大的伙伴感情线也在游戏的各个细节里。黄毛在这剧情里属于删掉都不影响真是个透明人,题材 监督 勇者 主角 力 监督 人 瓜 游戏 剧情 角色 伙伴 感情 线 游戏 细节 剧情 影响 透明人,剧情_摄像头_角色,[0.31175571 0.68824429]
感觉这次活动剧情像是扣出来的幻觉,感觉 活动 剧情 幻觉,剧情_摄像头_角色,[0.13190219 0.86809781]
省流15：26,省流,未知,[0.5 0.5]
一进来就没绷住,,未知,[0.5 0.5]
感觉这样看来剧情问题确实挺多的,感觉 剧情 问题,剧情_摄像头_角色,[0.35874835 0.64125165]
"迪卢克！开服T0火大剑 登龙的力量。正e人是在此空大卢姥爷！

琴团长！蒙德砍王就是 逃课的力量。疯鸭剑~超上天 雷荧讨债人的亲爹！

玉横星！金丝虾球迸发出双e的力量 璃月雷神刻晴猫猫

莫阿斯托洛吉斯·莫娜·梅姬斯图斯！她有挂水增伤占扑的力量

还有七七侠！她是你抽卡保底歪的铠甲",火 剑 登龙 力量 人 姥爷 琴 团长 力量 剑 讨债人 亲爹 金丝 虾球 双 力量 月 雷 晴 猫猫 水 力量 卡 保底 铠甲,未知,[0.5 0.5]
100985312，兄弟们快看我角色展示柜，整了个好活,兄弟 角色 展示柜 活,剧情_摄像头_角色,[0.49913882 0.50086118]
太惨了妮露厨，下一位是谁呢！,厨,未知,[0.5 0.5]
36:41正片开始,正片,未知,[0.5 0.5]
真是逆天完了，原这剧情,剧情,剧情_摄像头_角色,[0.25009805 0.74990195]
"原神还有救吗如有[星星眼]

https://www.bilibili.com/read/cv36212736",原神 星星 眼,原神_散兵_主角,[0.50316356 0.49683644]
他是觉得自己节奏还不够大，应该加大力度[妙啊],节奏,剧情_摄像头_角色,[0.25049526 0.74950474]
这波剧情根本就不是12+，简直是 r18+，只有成年人的世界里，才会有这种赤裸裸地摘桃子的戏码，真12+的剧情，一定是主角走到哪赢到哪,波 剧情 成年人 世界 地摘 桃子 戏码 剧情 主角,原神_散兵_主角,[0.55693989 0.44306011]
猜你想看15:12,,未知,[0.5 0.5]
"O神文案：别怨我??，公事公办罢了??，你很优秀??。 

但??...

你的旅途本不该在这里结束??，只可惜??，妮露举世皆敌的场面??，你看不到了??。

感谢你的648和氪的妮露皮肤??，那么......晚安??",神 文案 公事公办 旅途 场面 妮露 皮肤 晚安,原神_散兵_主角,[0.83284798 0.16715202]
饭吃完了才发??,饭,未知,[0.5 0.5]
不如鸣潮一根,鸣潮,剧情_摄像头_角色,[0.25180043 0.74819957]
黑糖快40万粉了啊,黑糖 粉,未知,[0.5 0.5]
不对，我切片呢，那对赤石兄弟呢？！我还要看一遍！[大哭][大哭][大哭][大哭]@黑椒糖唯酢,切片 赤石 兄弟 黑椒 糖,原神_散兵_主角,[0.62995352 0.37004648]
我去是散爷??????黄毛给您跪了??????,散爷,未知,[0.5 0.5]
省流版:36分40秒正片开始,省 正片,未知,[0.5 0.5]
唉????我有个点子直接快进到原神兔女郎不就行了??,点子 原神 兔女郎,原神_散兵_主角,[0.74986827 0.25013173]
主角就是没有学习到那维莱特的美德，直接说自己不是勇者不就行了，到时候是了，那我就是。不是，哎，我也没说我是啊，灵活的变通,主角 勇者 变通,原神_散兵_主角,[0.83321378 0.16678622]
"大家要知道原神并没有欠我们什么，他只是一款游戏，给你带来快乐，还要依着你的小脾气？ 他就算过年不出活动他也没有不对的地方，记住他没欠你，也许我们大家还欠米哈游一句谢谢。

海灯节顾名思义是游戏的节日，主角应该是它，收到节日礼物的也应该是它，我们为它准备了什么节日礼物？祝福一句没有，满是奖励就这点，还说游戏抠，你呢？

最后我希望所有人记佳一点，是我们选择的原神，不是原神选择的我们，原神、米哈游不欠我们，但是我们欠原神、米哈游一句谢谢，以及三年陪伴幸苦了，而不是在这口诛笔伐游戏的奖励多少，当个喂不饱的狼。",大家 原神 游戏 小 脾气 活动 地方 大家 海 灯节 游戏 主角 礼物 礼物 奖励 游戏 所有人 原神 原神 原神 原神 陪伴 游戏 奖励 狼,剧情_摄像头_角色,[0.47605 0.52395]
混测和大杂烩还是不一样的，在混测，连主角都有和剧情人物搞cp的权力。而在大杂烩，原神是这样的，黄毛只要每次装死晕过去好好当??就行了，而我们编剧如何为其他人物组cp就要考虑的很多了，毕竟我们原神编剧最大的责任不是编好所有角色的剧情，而是编好自己能编好的角色的剧情。,混测 大杂烩 混测 主角 剧情 人物 权力 大杂烩 原神 编剧 人物 原神 编剧 责任 角色 剧情 角色 剧情,剧情_摄像头_角色,[0.49951594 0.50048406]
看到好几个热评带马哈鱼的都没了[大笑][大笑],评带 鱼,未知,[0.5 0.5]
S13半决赛 JDG VS T1 第三局[doge][doge][doge],半决赛,未知,[0.5 0.5]
白蚁是吃原木的，没问题啊[吃瓜],白蚁 原木 问题 瓜,原神_散兵_主角,[0.74740114 0.25259886]
沟槽的双射手，散兵不配比大飞,沟槽 双 射手 散兵 飞,原神_散兵_主角,[0.74989975 0.25010025]
"有没有可能是下大棋[思考]

m故意把原搞成史，清除那些基本不用抽新角色就能玩的老登又能继续爆米[点赞]",大棋 成史 基本 角色 爆米,剧情_摄像头_角色,[0.25031386 0.74968614]
最新动态那个评论区太离谱了，前排全是一片详和，按时间排全在搞[吃瓜],动态 评论 离谱 时间 瓜,剧情_摄像头_角色,[0.39542893 0.60457107]
吃饭跟狗一桌的mxz来的这么快？fvv黄毛旅行者，你家散兵大人没力气了，快点去推一把啊??,狗 旅行者 散兵 大人 力气,原神_散兵_主角,[0.83323462 0.16676538]
"作为一个牛头人爱好者这次是真的想代入散兵视角了。

稍微出格点不就是经典的夫目前犯+隐姦。哎，原神的8+剧情还是限制了他的发挥??????",牛头人 爱好者 代入 散兵 视角 出格 经典 夫 犯 隐姦 原神 剧情,原神_散兵_主角,[0.69960473 0.30039527]
你觉得你是勇者吗？黄毛：我觉得我是,勇者,原神_散兵_主角,[0.7497693 0.2502307]
真的想不到? 一首21年的歌曲? 居然预判到了三年后的剧情,歌曲 预判 剧情,剧情_摄像头_角色,[0.25009805 0.74990195]
之前还在嘲笑解神者，现在原可以和解神者坐一桌了。[doge],神者 原 神者,未知,[0.5 0.5]
你把前三个世界带入1.0 2.0 3.0好像也很有意思,世界,原神_散兵_主角,[0.73066573 0.26933427]
大贤者：你有什么资格来教训我？须弥一城两港四部是在我的肩上担着，天下苍生这几个字还轮不到你来说！一个雷神玩剩下的愚人众，你都当个宝贝似的带回家，提瓦特七大神明的脸都让你丢尽了！??[doge],贤者 资格 教训 城 字 愚人 带回家 神明 脸,未知,[0.5 0.5]
但是我们的高级审美没问题啊，我们的高级审美，没人能碰我们的高级审美，我们的高级审美还在推塔，原神的第六手准备永远是这两个高级审美，第三个来了第三个来了，三姐妹我们仨保住三姐妹保住我们姐仨，原皮你吃得住我们这个高级审美的伤害吗，原皮还在这个使窝里边打滚，哎有难不玩来了有难不玩来了，原皮的龟壳被踩爆了，哎呀这下他们引以为傲的高级审美也要被秒掉了，而且这个宅男哥的气势已经续上了啊，这样的话wc其他的米家游戏也不好走，绝区零上线能换一个好像也换不了，啊有难不玩这个口号太要命了，哇×2,审美 问题 审美 人 审美 审美 推塔 原神 手 审美 姐妹 我们仨 姐妹 姐 原皮 审美 原皮 窝 原皮 龟壳 审美 男哥 气势 米家 游戏 绝区 零 上线 口号,原神_散兵_主角,[0.62220133 0.37779867]
原神官方不知道怎么写洗白可以去看看黑袍纠察队的火车头[尴尬],原神 官方 黑袍 纠察队 火车头,原神_散兵_主角,[0.74986827 0.25013173]
《勇者阿帽和他的红毛正宫以及三个黄毛丫鬟》,勇者 阿帽 红毛 正宫 丫鬟,原神_散兵_主角,[0.50385942 0.49614058]
阿如村里，一名贫穷的孩子在摇曳的烛光下阅读着书籍，希望有朝一日通过自己的努力进入教令院学习摆脱窘境，他从来不会想到，在他朝思暮想的神圣的教令院里，有一名罪犯正在逍遥快活??????,孩子 烛光 书籍 教令 院 窘境 教令 罪犯,未知,[0.5 0.5]
妮露纯纯的茶，感觉不如黄豆姐一根,茶 感觉 黄豆 姐,剧情_摄像头_角色,[0.25119519 0.74880481]
有米不玩，玩米不氪！,玩米,未知,[0.5 0.5]
"一刻也没有为利刃的消失而感到悲伤，接下来登场的是酷狗

一刻也没有为酷狗的消失而感到悲伤，接下来登场的是白蚁

唉，利刃，唉，酷狗，唉，白蚁

唉，tx打压，唉，美团打压，唉，b占打压

唉不动了??",利刃 消失 登场 酷狗 酷狗 消失 登场 白蚁 利刃 酷狗 白蚁,未知,[0.5 0.5]
说实话，但凡妮露对散兵的称呼不是“阿帽”这种亲昵的称呼，而是“流浪者”这种，我都不会太难受。编剧真的太恶心人了，有哪个女角色叫过主角“阿萤”或者“阿空”的？,散兵 流浪者 编剧 恶心 人 角色 主角 萤,原神_散兵_主角,[0.59617235 0.40382765]
"但凡给把主角换成狗,待遇都会更高",主角 狗 待遇,原神_散兵_主角,[0.74988137 0.25011863]
"但凡给把主角换成狗,待遇都会更高",主角 狗 待遇,原神_散兵_主角,[0.74988137 0.25011863]
up骂角色不对也没骂官方好听，希望骂官方的视频多一点，人的差异性不同，欣赏的点也不同，在反正“我不是黄毛，黄毛谁爱当谁当”的前提下，剧情其实还好，反正我没给mhy充钱，有满意的部分就抽，不满意就支持别人骂，吃瓜就行了。,角色 官方 官方 视频 人 前提 剧情 部分 瓜,剧情_摄像头_角色,[0.12514049 0.87485951]
建议米学长说服米哈游把米黑充的钱退了，米黑收到退款就会乖乖闭嘴了。[doge],建议 学长 钱,剧情_摄像头_角色,[0.25096198 0.74903802]
"今天是个美妙的夜晚? 

启动原神4.8开玩? 

氛围欢快童话模板? 

黄毛被拽进书本乐园? 

可莉妈压低帽檐翻开剧本? 

“我们故事现在开始”? 

“摄像机把见证的故事? 

记录在面前的这张白纸”? 

第一位名叫妮露她是故事的公主? 

第二位娜维亚她坐拥星轨的国土? 

第三位其他扮演的勇者他是须弥的腐乳 

最后所有人目光移向我问我扮演的角色是什么 

我看看身份说我是? 

黄毛开朗摄像头 

黄毛开朗摄像头? 

我特长只有昏倒看我垂涎的嘴角? 

黄毛开朗摄像头? 

黄毛开朗摄像头? 

我只是接了任务剧情还不能够跳? 

黄毛开朗摄像头? 

黄毛开朗摄像头? 

我花钱氪金爆米过得还很憋屈? 

黄毛开朗摄像头? 

黄毛开朗摄像头? 

这一段任务剧情和我有鸡毛关系",启动 原神 氛围 童话 模板 书本 乐园 可莉妈 帽檐 剧本 故事 摄像机 故事 记录 白纸 故事 公主 国土 勇者 腐乳 所有人 目光 角色 身份 摄像头 摄像头 特长 嘴角 摄像头 摄像头 任务 剧情 摄像头 摄像头 花钱 摄像头 摄像头 任务 剧情 鸡毛 关系,剧情_摄像头_角色,[0.14395912 0.85604088]
"这不就是剧本杀《阳光开朗摄像头》吗

王子公主，带刀侍卫都有了，摄像头就是个局外视角",剧本 摄像头 公主 刀 摄像头 局外 视角,剧情_摄像头_角色,[0.15431562 0.84568438]
勇者是童话世界里绝对正义的人，带领人们走向光明世界的最美好的人，无论如何是不能让有前科的人当的。本来旅行者就是最适合勇者的角色。还记得兰那罗送给我们的花环吗？我觉得那时候才是一个童话真主角该有的剧情。前面一直暗示我们是勇者，结果突然被散兵抢走了，而且人家还不稀罕：“你想要送给你当也无所谓。”给玩家一种连别人不要的东西都不配得到的感觉，加上剧情里为了卖角色强行加戏各种“被”无能“被”没用的表现，让代入旅行者的玩家体验很差。,勇者 童话世界 正义 人 人们 光明 世界 人 前科 人当 旅行者 勇者 角色 时候 童话 主角 剧情 勇者 结果 散兵 人家 玩家 感觉 剧情 角色 代入 旅行者 玩家 体验,剧情_摄像头_角色,[0.49792316 0.50207684]
剧情要用你自己的眼去看，自己的心去感受，不要被社区节奏带偏，后面忘了，总之赛博生命水军打压意难平,剧情 心 社区 节奏 生命 水军 意难,剧情_摄像头_角色,[0.16686947 0.83313053]
说一下我个人的看法看了这么多散兵相关的节奏，突然就理解了为什么MHY要不顾节奏一直推散兵了，其实这就是之前鸣潮时候说的库洛的行为——训狗。散兵从放出进卡池消息开始就是MHY在尝试提纯，在尝试能不能“站着把钱挣了”，事实证明MHY的尝试是正确的，每次节奏都有正反馈，每一波提纯都能让更多的玩家主动来为散兵为MHY发声，MHY真的就是站着把钱挣了，散兵的性格被部分玩家解读成傲娇，其实本质是傲慢，是MHY对玩家的傲慢;散兵对玩家的态度，其实就是MHY对玩家的态度，往后肯定还会有更多的散兵相关的剧情来给玩家喂??，继续提纯继续站着把钱挣了,个人 散兵 节奏 节奏 散兵 鸣潮 时候 训狗 散兵 消息 尝试 尝试 钱 尝试 节奏 波 玩家 散兵 钱 散兵 性格 部分 玩家 本质 玩家 散兵 玩家 态度 玩家 态度 散兵 剧情 玩家 钱,剧情_摄像头_角色,[0.37769217 0.62230783]
我之前还说原神剧情不如fate，现在看是不如一根啊,原神 剧情,剧情_摄像头_角色,[0.499834 0.500166]
这次剧情还是非常完美！就是摄像头拍进来了很影响观感，而且不需要给摄像头镜头，下次继续超神！加油！,剧情 摄像头 影响 观感 摄像头 镜头 超神,剧情_摄像头_角色,[0.10020746 0.89979254]
有人说这个杜林不是蒙德的杜林，有没有一种可能，就是这个你们口中的童话故事就是用来洗白祸害蒙德的那个杜林的，这不就是日子那套美化侵略战争吗？跟散兵战犯修改历史一个套路,祸害 日子 侵略战争 散兵 战犯 历史 套路,原神_散兵_主角,[0.74989975 0.25010025]
看到一条弹幕没绷住，解神者解的是原神的神,弹幕 原神 神,原神_散兵_主角,[0.74986827 0.25013173]
"世界级×

多元宇宙级√

继续保持，无条件支持mhy编剧[给心心]",世界级 宇宙 编剧,原神_散兵_主角,[0.50044107 0.49955893]
"原神已经是一个快4年的老游戏了，已经到了游戏生命周期的中晚期了，流水不行了很正常

现在男玩家都去玩男性向游戏了，而且剩下的男玩家大多是强度自由的老玩家，没什么抽卡动力了

角色设计应该多注重这两年新入坑的女玩家的喜好，像是须弥版本就不错。况且现在的女角色设计的再好男玩家也不会买账，再暴露也比不过麻辣神游，还会引起女玩家的不满

喜欢原来的角色完全可以抽复刻的老角色，过多的同质化角色只会影响复刻的销量，满足多元化喜好，多设计符合时代潮流方向的角色才是原神角色设计的关键",原神 老 游戏 游戏 生命周期 流水 男 玩家 男性 游戏 男 玩家 强度 老 玩家 卡 动力 角色 设计 坑 女 玩家 版本 女 角色 设计 男 玩家 神游 玩家 角色 老 角色 同质化 角色 影响 销量 多元化 设计 时代 潮流 方向 角色 原神 角色 设计 关键,剧情_摄像头_角色,[0.12396926 0.87603074]
评论怎么有的没了,评论,原神_散兵_主角,[0.72864575 0.27135425]
哈哈哈我就知道派蒙才是主角???? 乐子可太多了,主角 乐子,原神_散兵_主角,[0.50560967 0.49439033]
不懂了吧，这就是阳光开朗大男孩???,男孩,原神_散兵_主角,[0.74953646 0.25046354]
这视频看得我眉头紧锁，原来是我的三观不允许我接受这样的剧情????,视频 眉头 紧锁 三观 剧情,剧情_摄像头_角色,[0.16683865 0.83316135]
新剧情真不错，大家快去玩吧，都不玩，难道让我玩？[藏狐],剧情 大家 玩吧 藏狐,剧情_摄像头_角色,[0.16696898 0.83303102]
可恶，鸣潮的节奏居然被原神摘了桃子[大笑],鸣潮 节奏 原神 桃子,原神_散兵_主角,[0.5046119 0.4953881]
ggb五个元素都能成五灵王,元素,原神_散兵_主角,[0.7494704 0.2505296]
难怪刚开服要特意送1700原石[来古-呆滞],原石,未知,[0.5 0.5]
典型??子思维，我道歉＝我赎罪≠我认错，米厂多少是招了二??子或者小罕见的,典型 思维 赎罪 米厂,未知,[0.5 0.5]
我真是，本来想硬吃把免费的皮肤拿了，现在活动做一半看了这个结局，我三天没上原了[辣眼睛],免费 皮肤 活动 结局 辣 眼睛,原神_散兵_主角,[0.83715285 0.16284715]
搞了半天是录播啊。我还以为是下大棋呢[吃瓜],录播 棋 瓜,未知,[0.5 0.5]
"我真的服了，这种剧情有黑的必要吗？黑剧情的真的认真看过吗？尼禄是害羞的！旅行者是被封印能力的！?宝是不顾前嫌救我们的！?宝和小杜林，两个相似灵魂救赎不感动吗！?宝和小杜林的超甜对话怎么就融化不了你们冰冷的心呢！这么好的故事真的错付了[委屈]！建议以后有语音的对话要等cv念完才能跳，真的太多??了！最后我想说的原神真是一款好游戏，大家快来入坑啊！

你们都不玩难道让我玩吗？那我5.0后的乐子谁给我补啊，唉。",剧情 剧情 旅行者 能力 宝 宝 灵魂 宝 对话 融化 心 故事 建议 语音 对话 原神 游戏 大家 坑 乐子,剧情_摄像头_角色,[0.34880219 0.65119781]
"还是那句话：

你是勇者吗？

我觉得我是",勇者,原神_散兵_主角,[0.7497693 0.2502307]
如果你感觉这次剧情不好，那说明你该退游了，原神不值得，早点退坑，如果你感觉好，那么恭喜你，你成功被米哈游提纯了，你就是最适合玩原神的人。如果你现在想入坑，那么恭喜你，我手上有一个账号可以低价出售！！！,感觉 剧情 原神 坑 感觉 原神 人 坑 账号 低价 出售,剧情_摄像头_角色,[0.41979299 0.58020701]
"我同意妮露把摄像头扔地上。原因有两点。

1.你都不是勇者了，有什么资格躺在仙子的腿上？什么？你说你充钱了。好吧，我允许你在主角力竭的时候在后面推一下。

2.旅行者纯纯就是一个色批，故意的。五个元素里给头猪猪都能成世界英雄，你那么一个小的地方，你跟我说你摔晕了。你的风之翼呢？一看就是装的，活该被说应该扔在草地上。",摄像头 原因 勇者 资格 仙子 腿 主角 力竭 时候 旅行者 元素 头 猪猪 世界 地方,原神_散兵_主角,[0.68622027 0.31377973]
最后那首《阳光开朗大男孩》升华了主旨。[大笑],男孩 升华 主旨,原神_散兵_主角,[0.74953646 0.25046354]
浪子回头的经典剧情是 奈克瑟斯里沟吕木徒手搓光赎罪，这洗白杜林太蠢了,经典 剧情 徒手 光 赎罪,剧情_摄像头_角色,[0.25009805 0.74990195]
这剧情太好了，已经看了两天乐子了。为我带来了很多快乐，建议加大力度！早早退坑就是爽,剧情 乐子 建议 坑,剧情_摄像头_角色,[0.1253975 0.8746025]
你觉得你是勇者吗？黄毛小丑：我觉得我是,勇者,原神_散兵_主角,[0.7497693 0.2502307]
这不正好，5.0不用出了直接叫原神2得了,原神,原神_散兵_主角,[0.74986827 0.25013173]
这都是带节奏的，这次剧情非常好，我也十分喜欢，刚好5.0马上来了，是入坑的好时间，欢迎新人来玩,节奏 剧情 坑 时间 新人,剧情_摄像头_角色,[0.10025423 0.89974577]
省流：阳光开朗大男孩[doge],省流 男孩,原神_散兵_主角,[0.74953646 0.25046354]
就杜林这个罪行放隔壁，最少得是个车裂,罪行 车裂,未知,[0.5 0.5]
看了这么多剧情吐槽，还是这哥们看的最带劲,剧情 哥们,剧情_摄像头_角色,[0.25009805 0.74990195]
被散解恶心透了祝原神写出下一个纳塔太子爷，蒸蒸日上[汤圆],恶心 原神 太子,原神_散兵_主角,[0.51736678 0.48263322]
连箱子和鸟都是红蓝成对[吃瓜],箱子 鸟 成 瓜,未知,[0.5 0.5]
感觉不如mc剧情[元梦_哭哭],感觉 剧情 梦,剧情_摄像头_角色,[0.16710702 0.83289298]
散:我有一座雄伟的宝山，我是一出生就站在山顶的人，万事称心是我的特权，这个世界就是为了迎接我的到来才会存在的。[doge][doge],山顶 人 万事 特权 世界,原神_散兵_主角,[0.73066573 0.26933427]
最后一段音乐有没有纯享版？[吃瓜],音乐 瓜,未知,[0.5 0.5]
我都不知道为什么会有这么多人喷这次剧情，这次剧情简直就是封神级别，人物刻画饱满写实，剧情推进环环相扣，让我深刻明白现实中的点点滴滴，希望米哈游继续推出这样封神的剧情，我也十分喜欢，刚好5.0马上来了，是入坑的好时间，可是现在新人入坑门槛高，怎么解决呢，唉???，刚好我有个成品号练度还不错,人 剧情 剧情 级别 人物 刻画 剧情 现实 剧情 坑 时间 新人 坑 门槛 成品 号练度,剧情_摄像头_角色,[0.0556757 0.9443243]
[笑哭],,未知,[0.5 0.5]
米社,社,未知,[0.5 0.5]
?????,,未知,[0.5 0.5]
养成习惯，先投币,习惯 投币,未知,[0.5 0.5]
什么实力[doge],实力,未知,[0.5 0.5]
U1S1，我散兵好哥哥才是那个ML之神，自己用舒适了还不忘连夜亲自跨国快递给兄弟我送来爽爽~我真tm哭死[给心心][给心心][给心心],散兵 神 跨国 兄弟,原神_散兵_主角,[0.83313211 0.16686789]
为什么不是伞丧失勇者的资格，被剑刺穿。黄毛作为真正认可的勇者出场。,伞 勇者 资格 剑 勇者 出场,原神_散兵_主角,[0.83317538 0.16682462]
黃毛攝像機:我應該在車底?? 不應該在車裡? 看著你們有多甜蜜(唱,機,未知,[0.5 0.5]
咦，up以前不是做攻略视频的吗，发生什么了（虽然我更喜欢现在这种视频风格）,视频 视频 风格,剧情_摄像头_角色,[0.16694392 0.83305608]
纳维亚的帽子怎么换了，米又突破底层代码了,帽子 突破 底层 代码,未知,[0.5 0.5]
幽默黄毛??,,未知,[0.5 0.5]
等等，这开头怎么有种LOL解说的味道了[吃瓜],味道 瓜,未知,[0.5 0.5]
尬黑了，黄毛怎么就是纯摄像头了，他不是来拾破烂（原石）的吗,摄像头 原石,剧情_摄像头_角色,[0.25023129 0.74976871]
我现在愈发肯定米站和米桑确实有py交易了，就像之前水龙王的事，米桑没滑轨之前，骂的视频好像都上不了热门，滑轨之后你这个视频才能上热门。然后昨天热门清一色都是吹剧情的，而这个视频的数据都上不了[蛆音娘_摇头],交易 水 事 滑轨 视频 热门 滑轨 视频 热门 热门 剧情 视频 数据 蛆 音娘,剧情_摄像头_角色,[0.10013577 0.89986423]
"米哈游是

宣发比警车还响，流水比消防车还冲，比小轿车还能装修，商单比邮政车发的还勤，拉人比公交车还勤，最后一看，嚯，比火车还能装。",警车 流水 消防车 小轿车 商单 邮政车 公交车 火车 装,未知,[0.5 0.5]
看看隔壁吧家人们，只能说都是比出来的[鼓掌]，本来可以害行，比完之后更破防了??，我本可以忍受黑暗，为什么要让我见到光明????,人们 光明,未知,[0.5 0.5]
诶，你们这群肯定是连游戏都没玩过就在这云的??，我们O神在米油里可是好评不断，各位不要听他们这些黑子的话，这个夏活版本剧情非常好，诶，如果有新人想入坑的话，正好我这有个满级开服号??,游戏 云 神 油 黑子 版本 剧情 新人 坑,剧情_摄像头_角色,[0.10025369 0.89974631]
看我头像，破大防了。,头像,未知,[0.5 0.5]
